defect_id,card_id,audit_item,defect_type,severity,location_file,location_data,affected_rows,affected_tickers,affected_dates_range,reconciliation_status,reconciliation_rate,evidence_summary,repair_path,repair_feasibility,repair_effort_estimate,downstream_block_cards,notes,discovered_at
TOP_000001,KR-TOP100-PIT-LINEAGE-AUDIT-001,generation_script_existence,generation_script_missing,medium,repo,src/ scripts/ etc.,0,0,N/A,not_applicable,,Panel 의 dynamic_top100 은 외부 source (Kiwoom / KRX) 에서 이미 universe flag 가 적용된 상태로 제공. Repo 안에 generation script 없음.,requires_code_fix,high,rule documented = repo 내 reproduction script 작성 1-2 days,,rule was reverse-engineered (TOP_000002),2026-05-22T03:46:33.918603+00:00
TOP_000002,KR-TOP100-PIT-LINEAGE-AUDIT-001,selection_rule_reverse_engineering,none,informational,panel,거래대금추정 ranking,0,0,all,verified_against_internal,1.0,Dynamic Top100 selection rule = 거래대금추정 (trading value) 상위 100 (100/100 match across 25+ sample dates from 2018-2024). Market cap match = 59/100 average.,not_repairable,unknown,N/A,,Major positive finding: selection rule reproducible from panel data alone,2026-05-22T03:46:33.918603+00:00
TOP_000003,KR-TOP100-PIT-LINEAGE-AUDIT-001,membership_reproducibility,none,informational,panel,membership over time,0,0,all,verified_against_internal,1.0,Per-date top100 100% reproducible from 거래대금추정 ranking. Avg transition count per day = 1-2 new entries (small natural churn).,not_repairable,unknown,N/A,,positive,2026-05-22T03:46:33.918603+00:00
TOP_000004,KR-TOP100-PIT-LINEAGE-AUDIT-001,all_listed_candidate_universe,documentation_gap,low,panel,~563 tickers per date,969208,815,2018-2024,unverified,,Panel includes ~563 tickers per date (100 top100 + 463 candidates). Full KRX listed universe per date 별도 source 필요 (전 listed companies vs panel coverage).,requires_external_source,high,KRX listed companies file = 1 week,,,2026-05-22T03:46:33.918603+00:00
TOP_000005,KR-TOP100-PIT-LINEAGE-AUDIT-001,survivor_universe_check,none,informational,panel,lifecycle coverage,0,833,2018-2026,verified_against_internal,,833 unique tickers all had top100 entry at some point. 299 disappeared during panel = preserved in panel (not removed). Strong survivorship safety evidence.,not_repairable,unknown,N/A,,ID_000007 cross-reference positive,2026-05-22T03:46:33.918603+00:00
TOP_000006,KR-TOP100-PIT-LINEAGE-AUDIT-001,gate5_dependency,documentation_gap,high,panel,거래대금추정 trustworthiness,0,0,2018-2024,verified_against_internal,,"Top100 membership uses 거래대금추정 (trading value, PIT, 0% estimated). 거래대금추정 = 거래량 × close. Close 가 raw (adjusted X) = split day 에서 trading value 도 왜곡 가능. Top100 membership 이 corp action day 에 false 변동 가능.",requires_both,medium,Gate 5 fix 후 trading_value 재계산 = 1 week,KR-LIQ-MIGRATION-001 (Round 2 BACKLOG),Gate 5 dependency 명시,2026-05-22T03:46:33.918603+00:00
