pipeline_id,module_path,entry_function,role,expects_mask_column,behavior_on_missing_mask,behavior_on_invalid_row,consumed_columns,upstream_dependency,notes
equity_panel_loader,src/data/equity_panel.py,load_equity_panel,data_loader,False,n/a — this is the producer of valid_ohlcv_mask,annotates with valid_ohlcv_mask + invalid_ohlcv_reason_codes (mode='annotate'),"시가,고가,저가,종가,거래량,거래대금추정,거래대금추정여부",raw equity panel CSV files,"emits valid_ohlcv_mask, invalid_ohlcv_reason_codes, ohlcv_quarantine_run_at"
market_flow_loader,src/data/market_flow.py,load_market_flow,data_loader,False,"n/a — aggregate market flow, no OHLCV columns",n/a (no OHLCV); calls require_guarded_field_use for unit-ambiguous columns,"kospi_foreign_net,kospi_institution_net",market_flow CSV,records guard ack for ALLOW_WITH_GUARD columns at load time
universe_builder,src/data/universe.py,build_execution_universe,universe_construction,True,raises ValueError ('panel missing `valid_ohlcv_mask` from loader'),filters by valid_ohlcv_mask before liquidity / universe calculation,"KRX종가,거래대금추정,거래대금추정여부,동적유니버스포함",equity_panel_loader,hard gate at function entry; uses ANNOTATION_VALID_MASK_COL constant
sector_aggregator,src/data/sector_aggregator.py,_read_panel,data_loader,False,n/a — reads raw CSV directly with apply_ohlcv_quarantine(mode='filter'),drops rows matching S1-S6 before column rename / numeric coercion,"시가,고가,저가,종가,거래량,거래대금추정,거래대금추정여부 (raw); then renamed to daily_return,market_cap,...",raw equity panel CSV files,applies quarantine before renaming; filter mode
backtest_engine_entry,src/backtest/engine.py,run_candidate_backtest,backtest_entry,True,raises OhlcvQuarantineError,hard gate at entry; downstream price lookups happen against panel rows,"날짜,종목코드,시가,KRX종가",equity_panel_loader,"audit-only: this is a failure-mode gate, not a backtest run"
feature_stock_rs_score,src/features/stock_rs_score.py,build_stock_rs_scores,feature_builder,False,n/a — consumes sector_aggregator output (already filtered upstream),upstream_guarded via sector_aggregator filter,"date,ticker,sector_code,sector_name,daily_return",sector_aggregator,"calls require_guarded_field_use('daily_return', ...)"
feature_flow_ratios,src/features/flow_ratios.py,build_flow_ratios,feature_builder,False,n/a — consumes equity_panel_loader output,upstream_guarded via equity_panel_loader annotation,"거래대금추정,외국인순매수금액추정,기관순매수금액추정",equity_panel_loader,not directly patched in patch phase; relies on upstream mask
feature_market_gate,src/features/market_gate.py,build_market_gate_features,feature_builder,False,n/a — consumes loaders' output,upstream_guarded,"KRX종가, kospi_foreign_net, kospi_institution_net",equity_panel_loader + market_flow_loader,market_flow_loader calls require_guarded_field_use for unit-ambiguous cols
run_experiment_orchestrator,src/run_experiment.py,main / various,entry_point,True,indirect — calls equity_panel_loader (produces mask) and engine (fails closed if absent),upstream_guarded by loaders + downstream-gated by engine,all panel/flow columns,"equity_panel_loader, market_flow_loader, universe_builder, sector_aggregator, engine","24,725-line orchestrator; relies on upstream + downstream gates rather than per-line guards"
